Architecture Cut Off Ranks after Round 3 Allotment. Notified on 11.09.2023,Unnamed: 1,Unnamed: 2,Unnamed: 3,Round No
College Code,College Name,Course Name,Cut off Rank,3
E029,BMS School of Architecture,AT-Architecture,473,3
E077,M.S Ramaiah Institute of Technology,AT-Architecture,653,3
E163,SJB School of Architecture & Planning,AT-Architecture,462,3
E176,R V College of Architecture,AT-Architecture,542,3
E178,Wadiyar Centre For Architecture,AT-Architecture,447,3
E189,BMS College of Architecture,AT-Architecture,302,3
E193,Dayananda Sagar College of Architecture,AT-Architecture,600,3
